INDICATOR_CODE,INDICATOR_NAME,SOURCE_NOTE,SOURCE_ORGANIZATIONSG.VAW.ARGU.ZS,Women who believe a husband is justified in beating his wife when she argues with him (%),Percentage of women ages 15-49 who believe a husband/partner is justified in hitting or beating his wife/partner when she argues with him.,Demographic and Health Surveys (DHS) and Multiple Indicator Cluster Surveys (MICS)SG.VAW.BURN.ZS,Women who believe a husband is justified in beating his wife when she burns the food (%),Percentage of women ages 15-49 who believe a husband/partner is justified in hitting or beating his wife/partner when she burns the food.,Demographic and Health Surveys (DHS) and Multiple Indicator Cluster Surveys (MICS)SG.VAW.GOES.ZS,Women who believe a husband is justified in beating his wife when she goes out without telling him (%),Percentage of women ages 15-49 who believe a husband/partner is justified in hitting or beating his wife/partner when she goes out without telling him.,Demographic and Health Surveys (DHS) and Multiple Indicator Cluster Surveys (MICS)SG.VAW.NEGL.ZS,Women who believe a husband is justified in beating his wife when she neglects the children (%),Percentage of women ages 15-49 who believe a husband/partner is justified in hitting or beating his wife/partner when she neglects the children.,Demographic and Health Surveys (DHS) and Multiple Indicator Cluster Surveys (MICS)SG.VAW.REAS.ZS,Women who believe a husband is justified in beating his wife (any of five reasons) (%),Percentage of women ages 15-49 who believe a husband/partner is justified in hitting or beating his wife/partner for any of the following five reasons: argues with him; refuses to have sex; burns the food; goes out without telling him; or when she neglects the children.,Demographic and Health Surveys (DHS) and Multiple Indicator Cluster Surveys (MICS)SG.VAW.REFU.ZS,Women who believe a husband is justified in beating his wife when she refuses sex with him (%),Percentage of women ages 15-49 who believe a husband/partner is justified in hitting or beating his wife/partner when she refuses sex with him.,Demographic and Health Surveys (DHS) and Multiple Indicator Cluster Surveys (MICS)SH.ANM.CHLD.ZS,Prevalence of anemia among children (% of children under 5),"Prevalence of anemia, children under age 5, is the percentage of children under age 5 whose hemoglobin level is less than 110 grams per liter at sea level.","1. WHO. Global anemia prevalence and trends 1995-2011. Geneva: World Health Organization; forthcoming.  2. Stevens GA, Finucane MM, De-Regil LM, et al. Global, regional, and national trends in hemoglobin concentration and prevalence of total and severe anemia in children and pregnant and non-pregnant women for 1995-2011: a systematic analysis of population-representative data. The Lancet Global Health 2013; 1(1): e16-e25."SH.ANM.NPRG.ZS,Prevalence of anemia among non-pregnant women (% of women ages 15-49),"Prevalence of anemia, non-pregnant women, is the percentage of non-pregnant women whose hemoglobin level is less than 120 grams per liter at sea level.","World Health Organization, Worldwide Prevalence of Anemia."SH.CON.1524.FE.ZS,"Condom use, population ages 15-24, female (% of females ages 15-24)",Condom use is the percentage of the population ages 15-24 who used a condom at last intercourse in the last 12 months.,"Demographic and Health Surveys, and UNAIDS."SH.CON.1524.MA.ZS,"Condom use, population ages 15-24, male (% of males ages 15-24)",Condom use is the percentage of the population ages 15-24 who used a condom at last intercourse in the last 12 months.,"Demographic and Health Surveys, and UNAIDS."SH.DTH.COMM.ZS,"Cause of death, by communicable diseases and maternal, prenatal and nutrition conditions (% of total)","Cause of death refers to the share of all deaths for all ages by underlying causes. Communicable diseases and maternal, prenatal and nutrition conditions include infectious and parasitic diseases, respiratory infections, and nutritional deficiencies such as underweight and stunting.",Derived based on the data from WHO's World Health Statistics.SH.DTH.IMRT,Number of infant deaths,Number of infants dying before reaching one year of age.,"Estimates developed by the UN Inter-agency Group for Child Mortality Estimation (UNICEF, WHO, World Bank, UN DESA Population Division) at www.childmortality.org."SH.DTH.INJR.ZS,"Cause of death, by injury (% of total)",Cause of death refers to the share of all deaths for all ages by underlying causes. Injuries include unintentional and intentional injuries.,Derived based on the data from WHO's World Health Statistics.SH.DTH.MORT,Number of under-five deaths,Number of children dying before reaching age five.,"Estimates developed by the UN Inter-agency Group for Child Mortality Estimation (UNICEF, WHO, World Bank, UN DESA Population Division) at www.childmortality.org."SH.DTH.NCOM.ZS,"Cause of death, by non-communicable diseases (% of total)","Cause of death refers to the share of all deaths for all ages by underlying causes. Non-communicable diseases include cancer, diabetes mellitus, cardiovascular diseases, digestive diseases, skin diseases, musculoskeletal diseases, and congenital anomalies.",Derived based on the data from WHO's World Health Statistics.SH.DTH.NMRT,Number of neonatal deaths,Number of neonates dying before reaching 28 days of age.,"Estimates developed by the UN Inter-agency Group for Child Mortality Estimation (UNICEF, WHO, World Bank, UN DESA Population Division) at www.childmortality.org."SH.DYN.AIDS.FE.ZS,Women's share of population ages 15+ living with HIV (%),Prevalence of HIV is the percentage of people who are infected with HIV. Female rate is as a percentage of the total population ages 15+ who are living with HIV.,UNAIDS estimates.SH.DYN.AIDS.ZS,"Prevalence of HIV, total (% of population ages 15-49)",Prevalence of HIV refers to the percentage of people ages 15-49 who are infected with HIV.,UNAIDS estimates.SH.DYN.MORT,"Mortality rate, under-5 (per 1,000)","Under-five mortality rate is the probability per 1,000 that a newborn baby will die before reaching age five, if subject to age-specific mortality rates of the specified year.","Estimates Developed by the UN Inter-agency Group for Child Mortality Estimation (UNICEF, WHO, World Bank, UN DESA Population Division) at www.childmortality.org. Data for 2015 onwards are projections and from United Nations Populatoin Division's World Pop"SH.DYN.MORT.FE,"Mortality rate, under-5, female (per 1,000 live births)","Under-five mortality rate, female is the probability per 1,000 that a newborn female baby will die before reaching age five, if subject to female age-specific mortality rates of the specified year.","Estimates developed by the UN Inter-agency Group for Child Mortality Estimation (UNICEF, WHO, World Bank, UN DESA Population Division) at www.childmortality.org."SH.DYN.MORT.MA,"Mortality rate, under-5, male (per 1,000 live births)","Under-five mortality rate, male is the probability per 1,000 that a newborn male baby will die before reaching age five, if subject to male age-specific mortality rates of the specified year.","Estimates developed by the UN Inter-agency Group for Child Mortality Estimation (UNICEF, WHO, World Bank, UN DESA Population Division) at www.childmortality.org."SH.DYN.NMRT,"Mortality rate, neonatal (per 1,000 live births)","Neonatal mortality rate is the number of neonates dying before reaching 28 days of age, per 1,000 live births in a given year.","Estimates developed by the UN Inter-agency Group for Child Mortality Estimation (UNICEF, WHO, World Bank, UN DESA Population Division) at www.childmortality.org."SH.HIV.0014,Children (0-14) living with HIV,Children living with HIV refers to the number of children ages 0-14 who are infected with HIV.,UNAIDS estimates.SH.HIV.1524.FE.ZS,"Prevalence of HIV, female (% ages 15-24)",Prevalence of HIV is the percentage of people who are infected with HIV. Youth rates are as a percentage of the relevant age group.,UNAIDS estimates.SH.HIV.1524.MA.ZS,"Prevalence of HIV, male (% ages 15-24)",Prevalence of HIV is the percentage of people who are infected with HIV. Youth rates are as a percentage of the relevant age group.,UNAIDS estimates.SH.HIV.ARTC.ZS,Antiretroviral therapy coverage (% of people living with HIV),Antiretroviral therapy coverage indicates the percentage of all people living with HIV who are receiving antiretroviral therapy.,UNAIDS estimates.SH.IMM.IDPT,"Immunization, DPT (% of children ages 12-23 months)","Child immunization measures the percentage of children ages 12-23 months who received vaccinations before 12 months or at any time before the survey. A child is considered adequately immunized against diphtheria, pertussis (or whooping cough), and tetanus (DPT) after receiving three doses of vaccine.",WHO and UNICEF (http://www.who.int/immunization/monitoring_surveillance/en/).SH.IMM.MEAS,"Immunization, measles (% of children ages 12-23 months)",Child immunization measures the percentage of children ages 12-23 months who received vaccinations before 12 months or at any time before the survey. A child is considered adequately immunized against measles after receiving one dose of vaccine.,WHO and UNICEF (http://www.who.int/immunization/monitoring_surveillance/en/).SH.MED.BEDS.ZS,"Hospital beds (per 1,000 people)","Hospital beds include inpatient beds available in public, private, general, and specialized hospitals and rehabilitation centers. In most cases beds for both acute and chronic care are included.","Data are from the World Health Organization, supplemented by country data."SH.MED.CMHW.P3,"Community health workers (per 1,000 people)","Community health workers include various types of community health aides, many with country-specific occupational titles such as community health officers, community health-education workers, family health workers, lady health visitors and health extension package workers.","World Health Organization's Global Health Workforce Statistics, OECD, supplemented by country data."SH.MED.NUMW.P3,"Nurses and midwives (per 1,000 people)","Nurses and midwives include professional nurses, professional midwives, auxiliary nurses, auxiliary midwives, enrolled nurses, enrolled midwives and other associated personnel, such as dental nurses and primary care nurses.","World Health Organization's Global Health Workforce Statistics, OECD, supplemented by country data."SH.MED.PHYS.ZS,"Physicians (per 1,000 people)",Physicians include generalist and specialist medical practitioners.,"World Health Organization's Global Health Workforce Statistics, OECD, supplemented by country data."SH.MLR.NETS.ZS,Use of insecticide-treated bed nets (% of under-5 population),Use of insecticide-treated bed nets refers to the percentage of children under age five who slept under an insecticide-treated bednet to prevent malaria.,"UNICEF, State of the World's Children, Childinfo, and Demographic and Health Surveys."SH.MLR.TRET.ZS,Children with fever receiving antimalarial drugs (% of children under age 5 with fever),Malaria treatment refers to the percentage of children under age five who were ill with fever in the last two weeks and received any appropriate (locally defined) anti-malarial drugs.,"UNICEF, State of the World's Children, Childinfo, and Demographic and Health Surveys."SH.MMR.DTHS,Number of maternal deaths,"A maternal death refers to the death of a woman while pregnant or within 42 days of termination of pregnancy, irrespective of the duration and site of the pregnancy, from any cause related to or aggravated by the pregnancy or its management but not from accidental or incidental causes.","WHO, UNICEF, UNFPA, The World Bank, and the United Nations Population Division. Trends in Maternal Mortality: 1990 to 2015. Geneva, World Health Organization, 2015"SH.MMR.RISK,Lifetime risk of maternal death (1 in: rate varies by country),"Life time risk of maternal death is the probability that a 15-year-old female will die eventually from a maternal cause assuming that current levels of fertility and mortality (including maternal mortality) do not change in the future, taking into account competing causes of death. ","WHO, UNICEF, UNFPA, The World Bank, and the United Nations Population Division. Trends in Maternal Mortality: 1990 to 2015. Geneva, World Health Organization, 2015"SH.MMR.RISK.ZS,Lifetime risk of maternal death (%),"Life time risk of maternal death is the probability that a 15-year-old female will die eventually from a maternal cause assuming that current levels of fertility and mortality (including maternal mortality) do not change in the future, taking into account competing causes of death. ","WHO, UNICEF, UNFPA, The World Bank, and the United Nations Population Division. Trends in Maternal Mortality: 1990 to 2015. Geneva, World Health Organization, 2015"SH.PRG.ANEM,Prevalence of anemia among pregnant women (%),"Prevalence of anemia, pregnant women, is the percentage of pregnant women whose hemoglobin level is less than 110 grams per liter at sea level.","1. WHO. Global anemia prevalence and trends 1995-2011. Geneva: World Health Organization; forthcoming.  2. Stevens GA, Finucane MM, De-Regil LM, et al. Global, regional, and national trends in hemoglobin concentration and prevalence of total and severe anemia in children and pregnant and non-pregnant women for 1995-2011: a systematic analysis of population-representative data. The Lancet Global Health 2013; 1(1): e16-e25."SH.PRV.SMOK.FE,"Smoking prevalence, females (% of adults)","Prevalence of smoking, female is the percentage of women ages 15 and over who smoke any form of tobacco, including cigarettes, cigars, pipes or any other smoked tobacco products. Data include daily and non-daily or occasional smoking.","World Health Organization, Global Health Observatory Data Repository (http://apps.who.int/ghodata/)."SH.PRV.SMOK.MA,"Smoking prevalence, males (% of adults)","Prevalence of smoking, male is the percentage of men ages 15 and over who smoke any form of tobacco, including cigarettes, cigars, pipes or any other smoked tobacco products. Data include daily and non-daily or occasional smoking.","World Health Organization, Global Health Observatory Data Repository (http://apps.who.int/ghodata/)."SH.STA.ACSN,Improved sanitation facilities (% of population with access),"Access to improved sanitation facilities refers to the percentage of the population using improved sanitation facilities. Improved sanitation facilities are likely to ensure hygienic separation of human excreta from human contact. They include flush/pour flush (to piped sewer system, septic tank, pit latrine), ventilated improved pit (VIP) latrine, pit latrine with slab, and composting toilet.",WHO/UNICEF Joint Monitoring Programme (JMP) for Water Supply and Sanitation (http://www.wssinfo.org/).SH.STA.ACSN.RU,"Improved sanitation facilities, rural (% of rural population with access)","Access to improved sanitation facilities refers to the percentage of the population using improved sanitation facilities. Improved sanitation facilities are likely to ensure hygienic separation of human excreta from human contact. They include flush/pour flush (to piped sewer system, septic tank, pit latrine), ventilated improved pit (VIP) latrine, pit latrine with slab, and composting toilet.",WHO/UNICEF Joint Monitoring Programme (JMP) for Water Supply and Sanitation (http://www.wssinfo.org/).SH.STA.ACSN.UR,"Improved sanitation facilities, urban (% of urban population with access)","Access to improved sanitation facilities refers to the percentage of the population using improved sanitation facilities. Improved sanitation facilities are likely to ensure hygienic separation of human excreta from human contact. They include flush/pour flush (to piped sewer system, septic tank, pit latrine), ventilated improved pit (VIP) latrine, pit latrine with slab, and composting toilet.",WHO/UNICEF Joint Monitoring Programme (JMP) for Water Supply and Sanitation (http://www.wssinfo.org/).SH.STA.ANVC.ZS,Pregnant women receiving prenatal care (%),Pregnant women receiving prenatal care are the percentage of women attended at least once during pregnancy by skilled health personnel for reasons related to pregnancy.,"UNICEF, State of the World's Children, Childinfo, and Demographic and Health Surveys."SH.STA.ARIC.ZS,ARI treatment (% of children under 5 taken to a health provider),"Children with acute respiratory infection (ARI) who are taken to a health provider refers to the percentage of children under age five with ARI in the last two weeks who were taken to an appropriate health provider, including hospital, health center, dispensary, village health worker, clinic, and private physician.","UNICEF, State of the World's Children, Childinfo, and Demographic and Health Surveys."SH.STA.BFED.ZS,Exclusive breastfeeding (% of children under 6 months),Exclusive breastfeeding refers to the percentage of children less than six months old who are fed breast milk alone (no other liquids) in the past 24 hours.,"UNICEF, State of the World's Children, Childinfo, and Demographic and Health Surveys."SH.STA.BRTC.ZS,Births attended by skilled health staff (% of total),"Births attended by skilled health staff are the percentage of deliveries attended by personnel trained to give the necessary supervision, care, and advice to women during pregnancy, labor, and the postpartum period; to conduct deliveries on their own; and to care for newborns.","UNICEF, State of the World's Children, Childinfo, and Demographic and Health Surveys."SH.STA.BRTW.ZS,Low-birthweight babies (% of births),"Low-birthweight babies are newborns weighing less than 2,500 grams, with the measurement taken within the first hours of life, before significant postnatal weight loss has occurred.","UNICEF, State of the World's Children, Childinfo, and Demographic and Health Surveys."SH.STA.DIAB.ZS,Diabetes prevalence (% of population ages 20 to 79),Diabetes prevalence refers to the percentage of people ages 20-79 who have type 1 or type 2 diabetes.,"International Diabetes Federation, Diabetes Atlas."SH.STA.MALN.FE.ZS,"Prevalence of underweight, weight for age, female (% of children under 5)",Prevalence of underweight children is the percentage of children under age 5 whose weight for age is more than two standard deviations below the median for the international reference population ages 0-59 months. The data are based on the WHO's new child growth standards released in 2006.,"World Health Organization, Global Database on Child Growth and Malnutrition. Country-level data are unadjusted data from national surveys, and thus may not be comparable across countries."SH.STA.MALN.MA.ZS,"Prevalence of underweight, weight for age, male (% of children under 5)",Prevalence of underweight children is the percentage of children under age 5 whose weight for age is more than two standard deviations below the median for the international reference population ages 0-59 months. The data are based on the WHO's new child growth standards released in 2006.,"World Health Organization, Global Database on Child Growth and Malnutrition. Country-level data are unadjusted data from national surveys, and thus may not be comparable across countries."SH.STA.MALN.ZS,"Prevalence of underweight, weight for age (% of children under 5)",Prevalence of underweight children is the percentage of children under age 5 whose weight for age is more than two standard deviations below the median for the international reference population ages 0-59 months. The data are based on the WHO's new child growth standards released in 2006.,"World Health Organization, Global Database on Child Growth and Malnutrition. Country-level data are unadjusted data from national surveys, and thus may not be comparable across countries. Adjusted, comparable data are available at http://www.who.int/nutgrowthdb/en. Aggregation is based on UNICEF, WHO, and the World Bank harmonized dataset (adjusted, comparable data) and methodology."SH.STA.MMRT,"Maternal mortality ratio (modeled estimate, per 100,000 live births)","Maternal mortality ratio is the number of women who die from pregnancy-related causes while pregnant or within 42 days of pregnancy termination per 100,000 live births. The data are estimated with a regression model using information on the proportion of maternal deaths among non-AIDS deaths in women ages 15-49, fertility, birth attendants, and GDP.","WHO, UNICEF, UNFPA, The World Bank, and the United Nations Population Division. Trends in Maternal Mortality: 1990 to 2015. Geneva, World Health Organization, 2015"SH.STA.MMRT.NE,"Maternal mortality ratio (national estimate, per 100,000 live births)","Maternal mortality ratio is the number of women who die from pregnancy-related causes while pregnant or within 42 days of pregnancy termination per 100,000 live births.","UNICEF, State of the World's Children, Childinfo, and Demographic and Health Surveys."SH.STA.ORCF.ZS,Diarrhea treatment (% of children under 5 receiving oral rehydration and continued feeding),"Children with diarrhea who received oral rehydration and continued feeding refer to the percentage of children under age five with diarrhea in the two weeks prior to the survey who received either oral rehydration therapy or increased fluids, with continued feeding.","UNICEF, State of the World's Children, Childinfo, and Demographic and Health Surveys."SH.STA.ORTH,Diarrhea treatment (% of children under 5 who received ORS packet),Percentage of children under age 5 with diarrhea in the two weeks preceding the survey who received oral rehydration salts (ORS packets or pre-packaged ORS fluids).,"UNICEF, State of the World's Children, Childinfo, and Demographic and Health Surveys."SH.STA.OWGH.FE.ZS,"Prevalence of overweight, weight for height, female (% of children under 5)",Prevalence of overweight children is the percentage of children under age 5 whose weight for height is more than two standard deviations above the median for the international reference population of the corresponding age as established by the WHO's new child growth standards released in 2006.,"World Health Organization, Global Database on Child Growth and Malnutrition. Country-level data are unadjusted data from national surveys, and thus may not be comparable across countries."SH.STA.OWGH.MA.ZS,"Prevalence of overweight, weight for height, male (% of children under 5)",Prevalence of overweight children is the percentage of children under age 5 whose weight for height is more than two standard deviations above the median for the international reference population of the corresponding age as established by the WHO's new child growth standards released in 2006.,"World Health Organization, Global Database on Child Growth and Malnutrition. Country-level data are unadjusted data from national surveys, and thus may not be comparable across countries."SH.STA.OWGH.ZS,"Prevalence of overweight, weight for height (% of children under 5)",Prevalence of overweight children is the percentage of children under age 5 whose weight for height is more than two standard deviations above the median for the international reference population of the corresponding age as established by the WHO's new child growth standards released in 2006.,"World Health Organization, Global Database on Child Growth and Malnutrition. Country-level data are unadjusted data from national surveys, and thus may not be comparable across countries. Adjusted, comparable data are available at http://www.who.int/nutgrowthdb/en. Aggregation is based on UNICEF, WHO, and the World Bank harmonized dataset (adjusted, comparable data) and methodology."SH.STA.STNT.FE.ZS,"Prevalence of stunting, height for age, female (% of children under 5)",Prevalence of stunting is the percentage of children under age 5 whose height for age is more than two standard deviations below the median for the international reference population ages 0-59 months. For children up to two years old height is measured by recumbent length. For older children height is measured by stature while standing. The data are based on the WHO's new child growth standards released in 2006.,"World Health Organization, Global Database on Child Growth and Malnutrition. Country-level data are unadjusted data from national surveys, and thus may not be comparable across countries."SH.STA.STNT.MA.ZS,"Prevalence of stunting, height for age, male (% of children under 5)",Prevalence of stunting is the percentage of children under age 5 whose height for age is more than two standard deviations below the median for the international reference population ages 0-59 months. For children up to two years old height is measured by recumbent length. For older children height is measured by stature while standing. The data are based on the WHO's new child growth standards released in 2006.,"World Health Organization, Global Database on Child Growth and Malnutrition. Country-level data are unadjusted data from national surveys, and thus may not be comparable across countries."