INDICATOR_CODE,INDICATOR_NAME,SOURCE_NOTE,SOURCE_ORGANIZATIONSH.STA.STNT.ZS,"Prevalence of stunting, height for age (% of children under 5)",Prevalence of stunting is the percentage of children under age 5 whose height for age is more than two standard deviations below the median for the international reference population ages 0-59 months. For children up to two years old height is measured by recumbent length. For older children height is measured by stature while standing. The data are based on the WHO's new child growth standards released in 2006.,"World Health Organization, Global Database on Child Growth and Malnutrition. Country-level data are unadjusted data from national surveys, and thus may not be comparable across countries. Adjusted, comparable data are available at http://www.who.int/nutgrowthdb/en. Aggregation is based on UNICEF, WHO, and the World Bank harmonized dataset (adjusted, comparable data) and methodology."SH.STA.WAST.FE.ZS,"Prevalence of wasting, weight for height, female (% of children under 5)",Wasting prevalence is the proportion of children under five whose weight for height is more than two standard deviations below the median for the international reference population ages 0-59.,"World Health Organization, Global Database on Child Growth and Malnutrition. Country-level data are unadjusted data from national surveys, and thus may not be comparable across countries."SH.STA.WAST.MA.ZS,"Prevalence of wasting, weight for height, male (% of children under 5)",Wasting prevalence is the proportion of children under five whose weight for height is more than two standard deviations below the median for the international reference population ages 0-59.,"World Health Organization, Global Database on Child Growth and Malnutrition. Country-level data are unadjusted data from national surveys, and thus may not be comparable across countries."SH.STA.WAST.ZS,"Prevalence of wasting, weight for height (% of children under 5)",Wasting prevalence is the proportion of children under five whose weight for height is more than two standard deviations below the median for the international reference population ages 0-59.,"World Health Organization, Global Database on Child Growth and Malnutrition. Country-level data are unadjusted data from national surveys, and thus may not be comparable across countries. Adjusted, comparable data are available at http://www.who.int/nutgrowthdb/en. Aggregation is based on UNICEF, WHO, and the World Bank harmonized dataset (adjusted, comparable data) and methodology."SH.SVR.WAST.FE.ZS,"Prevalence of severe wasting, weight for height, female (% of children under 5)",Severe wasting prevalence is the proportion of children under five whose weight for height is more than three standard deviations below the median for the international reference population ages 0-59.,"World Health Organization, Global Database on Child Growth and Malnutrition. Country-level data are unadjusted data from national surveys, and thus may not be comparable across countries."SH.SVR.WAST.MA.ZS,"Prevalence of severe wasting, weight for height, male (% of children under 5)",Severe wasting prevalence is the proportion of children under five whose weight for height is more than three standard deviations below the median for the international reference population ages 0-59.,"World Health Organization, Global Database on Child Growth and Malnutrition. Country-level data are unadjusted data from national surveys, and thus may not be comparable across countries."SH.SVR.WAST.ZS,"Prevalence of severe wasting, weight for height (% of children under 5)",Severe wasting prevalence is the proportion of children under five whose weight for height is more than three standard deviations below the median for the international reference population ages 0-59.,"World Health Organization, Global Database on Child Growth and Malnutrition. Country-level data are unadjusted data from national surveys, and thus may not be comparable across countries. Adjusted, comparable data are available at http://www.who.int/nutgrowthdb/en. Aggregation is based on UNICEF, WHO, and the World Bank harmonized dataset (adjusted, comparable data) and methodology."SH.TBS.CURE.ZS,Tuberculosis treatment success rate (% of new cases),"Tuberculosis treatment success rate is the percentage of all new tuberculosis cases (or new and relapse cases for some countries) registered under a national tuberculosis control programme in a given year that successfully completed treatment, with or without bacteriological evidence of success (""cured"" and ""treatment completed"" respectively).","World Health Organization, Global Tuberculosis Control Report."SH.TBS.DTEC.ZS,"Tuberculosis case detection rate (%, all forms)","Tuberculosis case detection rate (all forms) is the number of new and relapse tuberculosis cases notified to WHO in a given year, divided by WHO's estimate of the number of incident tuberculosis cases for the same year, expressed as a percentage. Estimates for all years are recalculated as new information becomes available and techniques are refined, so they may differ from those published previously.","World Health Organization, Global Tuberculosis Report."SH.TBS.INCD,"Incidence of tuberculosis (per 100,000 people)","Incidence of tuberculosis is the estimated number of new and relapse tuberculosis cases arising in a given year, expressed as the rate per 100,000 population. All forms of TB are included, including cases in people living with HIV. Estimates for all years are recalculated as new information becomes available and techniques are refined, so they may differ from those published previously.","World Health Organization, Global Tuberculosis Report."SH.VAC.TTNS.ZS,Newborns protected against tetanus (%),Newborns protected against tetanus are the percentage of births by women of child-bearing age who are immunized against tetanus.,WHO and UNICEF (http://www.who.int/immunization/monitoring_surveillance/en/).SH.XPD.EXTR.ZS,External resources for health (% of total expenditure on health),"External resources for health are funds or services in kind that are provided by entities not part of the country in question. The resources may come from international organizations, other countries through bilateral arrangements, or foreign nongovernmental organizations. These resources are part of total health expenditure.",World Health Organization Global Health Expenditure database (see http://apps.who.int/nha/database for the most recent updates).SH.XPD.OOPC.TO.ZS,Out-of-pocket health expenditure (% of total expenditure on health),"Out of pocket expenditure is any direct outlay by households, including gratuities and in-kind payments, to health practitioners and suppliers of pharmaceuticals, therapeutic appliances, and other goods and services whose primary intent is to contribute to the restoration or enhancement of the health status of individuals or population groups. It is a part of private health expenditure.",World Health Organization Global Health Expenditure database (see http://apps.who.int/nha/database for the most recent updates).SH.XPD.OOPC.ZS,Out-of-pocket health expenditure (% of private expenditure on health),"Out of pocket expenditure is any direct outlay by households, including gratuities and in-kind payments, to health practitioners and suppliers of pharmaceuticals, therapeutic appliances, and other goods and services whose primary intent is to contribute to the restoration or enhancement of the health status of individuals or population groups. It is a part of private health expenditure.",World Health Organization Global Health Expenditure database (see http://apps.who.int/nha/database for the most recent updates).SH.XPD.PCAP,Health expenditure per capita (current US$),"Total health expenditure is the sum of public and private health expenditures as a ratio of total population. It covers the provision of health services (preventive and curative), family planning activities, nutrition activities, and emergency aid designated for health but does not include provision of water and sanitation. Data are in current U.S. dollars.",World Health Organization Global Health Expenditure database (see http://apps.who.int/nha/database for the most recent updates).SH.XPD.PCAP.PP.KD,"Health expenditure per capita, PPP (constant 2011 international $)","Total health expenditure is the sum of public and private health expenditures as a ratio of total population. It covers the provision of health services (preventive and curative), family planning activities, nutrition activities, and emergency aid designated for health but does not include provision of water and sanitation. Data are in international dollars converted using 2011 purchasing power parity (PPP) rates.",World Health Organization Global Health Expenditure database (see http://apps.who.int/nha/database for the most recent updates).SH.XPD.PRIV.ZS,"Health expenditure, private (% of GDP)","Private health expenditure includes direct household (out-of-pocket) spending, private insurance, charitable donations, and direct service payments by private corporations.",World Health Organization Global Health Expenditure database (see http://apps.who.int/nha/database for the most recent updates).SH.XPD.PUBL,"Health expenditure, public (% of total health expenditure)","Public health expenditure consists of recurrent and capital spending from government (central and local) budgets, external borrowings and grants (including donations from international agencies and nongovernmental organizations), and social (or compulsory) health insurance funds. Total health expenditure is the sum of public and private health expenditure. It covers the provision of health services (preventive and curative), family planning activities, nutrition activities, and emergency aid designated for health but does not include provision of water and sanitation.",World Health Organization Global Health Expenditure database (see http://apps.who.int/nha/database for the most recent updates).SH.XPD.PUBL.GX.ZS,"Health expenditure, public (% of government expenditure)","Public health expenditure consists of recurrent and capital spending from government (central and local) budgets, external borrowings and grants (including donations from international agencies and nongovernmental organizations), and social (or compulsory) health insurance funds.",World Health Organization Global Health Expenditure database (see http://apps.who.int/nha/database for the most recent updates).SH.XPD.PUBL.ZS,"Health expenditure, public (% of GDP)","Public health expenditure consists of recurrent and capital spending from government (central and local) budgets, external borrowings and grants (including donations from international agencies and nongovernmental organizations), and social (or compulsory) health insurance funds.",World Health Organization Global Health Expenditure database (see http://apps.who.int/nha/database for the most recent updates).SH.XPD.TOTL.ZS,"Health expenditure, total (% of GDP)","Total health expenditure is the sum of public and private health expenditure. It covers the provision of health services (preventive and curative), family planning activities, nutrition activities, and emergency aid designated for health but does not include provision of water and sanitation.",World Health Organization Global Health Expenditure database (see http://apps.who.int/nha/database for the most recent updates).SN.ITK.DEFC.ZS,Prevalence of undernourishment (% of population),Population below minimum level of dietary energy consumption (also referred to as prevalence of undernourishment) shows the percentage of the population whose food intake is insufficient to meet dietary energy requirements continuously. Data showing as 2.5 signifies a prevalence of undernourishment below 2.5%.,Food and Agriculture Organization (http://www.fao.org/publications/en/).SN.ITK.DFCT,Depth of the food deficit (kilocalories per person per day),"The depth of the food deficit indicates how many calories would be needed to lift the undernourished from their status, everything else being constant. The average intensity of food deprivation of the undernourished, estimated as the difference between the average dietary energy requirement and the average dietary energy consumption of the undernourished population (food-deprived), is multiplied by the number of undernourished to provide an estimate of the total food deficit in the country, which is then normalized by the total population.","Food and Agriculture Organization, Food Security Statistics."SN.ITK.SALT.ZS,Consumption of iodized salt (% of households),Consumption of iodized salt refers to the percentage of households that use edible salt fortified with iodine.,"United Nations Children's Fund, State of the World's Children."SN.ITK.VITA.ZS,Vitamin A supplementation coverage rate (% of children ages 6-59 months),Vitamin A supplementation refers to the percentage of children ages 6-59 months old who received at least two doses of vitamin A in the previous year.,"United Nations Children's Fund, State of the World's Children."SP.ADO.TFRT,"Adolescent fertility rate (births per 1,000 women ages 15-19)","Adolescent fertility rate is the number of births per 1,000 women ages 15-19.","United Nations Population Division, World Population Prospects."SP.DTH.INFR.ZS,Completeness of infant death reporting (% of reported infant deaths to estimated infant deaths),Completeness of infant death reporting is the number of infant deaths reported by national statistics authorities to the United Nations Statistics Division's Demography Yearbook divided by the number of infant deaths estimated by the United Nations Population Division.,The United Nations Statistics Division's Population and Vital Statistics Report and the United Nations Population Division's World Population Prospects.SP.DTH.REPT.ZS,Completeness of total death reporting (% of reported total deaths to estimated total deaths),Completeness of total death reporting is the number of total deaths reported by national statistics authorities to the United Nations Statistics Division's Demography Yearbook divided by the number of total deaths estimated by the United Nations Population Division.,The United Nations Statistics Division's Population and Vital Statistics Report and the United Nations Population Division's World Population Prospects.SP.DYN.AMRT.FE,"Mortality rate, adult, female (per 1,000 female adults)","Adult mortality rate is the probability of dying between the ages of 15 and 60--that is, the probability of a 15-year-old dying before reaching age 60, if subject to current age-specific mortality rates between those ages.","(1) United Nations Population Division. World Population Prospects. New York, United Nations, Department of Economic and Social Affairs (advanced Excel tables). Available at http://esa.un.org/wpp/unpp/panel_population.htm, (2) University of California, Berkeley, and Max Planck Institute for Demographic Research. Human Mortality Database. [ www.mortality.org or www.humanmortality.de]."SP.DYN.AMRT.MA,"Mortality rate, adult, male (per 1,000 male adults)","Adult mortality rate is the probability of dying between the ages of 15 and 60--that is, the probability of a 15-year-old dying before reaching age 60, if subject to current age-specific mortality rates between those ages.","(1) United Nations Population Division. World Population Prospects. New York, United Nations, Department of Economic and Social Affairs (advanced Excel tables). Available at http://esa.un.org/wpp/unpp/panel_population.htm, (2) University of California, Berkeley, and Max Planck Institute for Demographic Research. Human Mortality Database. [ www.mortality.org or www.humanmortality.de]."SP.DYN.CBRT.IN,"Birth rate, crude (per 1,000 people)","Crude birth rate indicates the number of live births occurring during the year, per 1,000 population estimated at midyear. Subtracting the crude death rate from the crude birth rate provides the rate of natural increase, which is equal to the rate of population change in the absence of migration.","(1) United Nations Population Division. World Population Prospects, (2) United Nations Statistical Division. Population and Vital Statistics Report (various years), (3) Census reports and other statistical publications from national statistical offices, (4) Eurostat: Demographic Statistics, (5) Secretariat of the Pacific Community: Statistics and Demography Programme, and (6) U.S. Census Bureau: International Database."SP.DYN.CDRT.IN,"Death rate, crude (per 1,000 people)","Crude death rate indicates the number of deaths occurring during the year, per 1,000 population estimated at midyear. Subtracting the crude death rate from the crude birth rate provides the rate of natural increase, which is equal to the rate of population change in the absence of migration.","(1) United Nations Population Division. World Population Prospects, (2) United Nations Statistical Division. Population and Vital Statistics Report (various years), (3) Census reports and other statistical publications from national statistical offices, (4) Eurostat: Demographic Statistics, (5) Secretariat of the Pacific Community: Statistics and Demography Programme, and (6) U.S. Census Bureau: International Database."SP.DYN.CONU.ZS,Contraceptive prevalence (% of women ages 15-49),"Contraceptive prevalence rate is the percentage of women who are practicing, or whose sexual partners are practicing, any form of contraception. It is usually measured for married women ages 15-49 only.","UNICEF's State of the World's Children and Childinfo, United Nations Population Division's World Contraceptive Use, household surveys including Demographic and Health Surveys and Multiple Indicator Cluster Surveys."SP.DYN.IMRT.FE.IN,"Mortality rate, infant, female (per 1,000 live births)","Infant mortality rate, female is the number of female infants dying before reaching one year of age, per 1,000 female live births in a given year.","Estimates developed by the UN Inter-agency Group for Child Mortality Estimation (UNICEF, WHO, World Bank, UN DESA Population Division) at www.childmortality.org."SP.DYN.IMRT.IN,"Mortality rate, infant (per 1,000 live births)","Infant mortality rate is the number of infants dying before reaching one year of age, per 1,000 live births in a given year.","Estimates developed by the UN Inter-agency Group for Child Mortality Estimation (UNICEF, WHO, World Bank, UN DESA Population Division) at www.childmortality.org."SP.DYN.IMRT.MA.IN,"Mortality rate, infant, male (per 1,000 live births)","Infant mortality rate, male is the number of male infants dying before reaching one year of age, per 1,000 male live births in a given year.","Estimates developed by the UN Inter-agency Group for Child Mortality Estimation (UNICEF, WHO, World Bank, UN DESA Population Division) at www.childmortality.org."SP.DYN.LE00.FE.IN,"Life expectancy at birth, female (years)",Life expectancy at birth indicates the number of years a newborn infant would live if prevailing patterns of mortality at the time of its birth were to stay the same throughout its life.,"(1) United Nations Population Division. World Population Prospects, (2) United Nations Statistical Division. Population and Vital Statistics Report (various years), (3) Census reports and other statistical publications from national statistical offices, (4) Eurostat: Demographic Statistics, (5) Secretariat of the Pacific Community: Statistics and Demography Programme, and (6) U.S. Census Bureau: International Database."SP.DYN.LE00.IN,"Life expectancy at birth, total (years)",Life expectancy at birth indicates the number of years a newborn infant would live if prevailing patterns of mortality at the time of its birth were to stay the same throughout its life.,"Derived from male and female life expectancy at birth from sources such as: (1) United Nations Population Division. World Population Prospects, (2) United Nations Statistical Division. Population and Vital Statistics Report (various years), (3) Census reports and other statistical publications from national statistical offices, (4) Eurostat: Demographic Statistics, (5) Secretariat of the Pacific Community: Statistics and Demography Programme, and (6) U.S. Census Bureau: International Database."SP.DYN.LE00.MA.IN,"Life expectancy at birth, male (years)",Life expectancy at birth indicates the number of years a newborn infant would live if prevailing patterns of mortality at the time of its birth were to stay the same throughout its life.,"(1) United Nations Population Division. World Population Prospects, (2) United Nations Statistical Division. Population and Vital Statistics Report (various years), (3) Census reports and other statistical publications from national statistical offices, (4) Eurostat: Demographic Statistics, (5) Secretariat of the Pacific Community: Statistics and Demography Programme, and (6) U.S. Census Bureau: International Database."SP.DYN.TFRT.IN,"Fertility rate, total (births per woman)",Total fertility rate represents the number of children that would be born to a woman if she were to live to the end of her childbearing years and bear children in accordance with current age-specific fertility rates.,"(1) United Nations Population Division. World Population Prospects, (2) United Nations Statistical Division. Population and Vital Statistics Report (various years), (3) Census reports and other statistical publications from national statistical offices, (4) Eurostat: Demographic Statistics, (5) Secretariat of the Pacific Community: Statistics and Demography Programme, and (6) U.S. Census Bureau: International Database"SP.DYN.TO65.FE.ZS,"Survival to age 65, female (% of cohort)","Survival to age 65 refers to the percentage of a cohort of newborn infants that would survive to age 65, if subject to current age specific mortality rates.","United Nations Population Division. World Population Prospects. New York, United Nations, Department of Economic and Social Affairs (advanced Excel tables). Available at http://esa.un.org/wpp/unpp/panel_population.htm."SP.DYN.TO65.MA.ZS,"Survival to age 65, male (% of cohort)","Survival to age 65 refers to the percentage of a cohort of newborn infants that would survive to age 65, if subject to current age specific mortality rates.","United Nations Population Division. World Population Prospects. New York, United Nations, Department of Economic and Social Affairs (advanced Excel tables). Available at http://esa.un.org/wpp/unpp/panel_population.htm."SP.DYN.WFRT,Wanted fertility rate (births per woman),Wanted fertility rate is an estimate of what the total fertility rate would be if all unwanted births were avoided.,Demographic and Health Surveys.SP.HOU.FEMA.ZS,Female headed households (% of households with a female head),Female headed households shows the percentage of households with a female head.,Demographic and Health Surveys.SP.MTR.1519.ZS,Teenage mothers (% of women ages 15-19 who have had children or are currently pregnant),Teenage mothers are the percentage of women ages 15-19 who already have children or are currently pregnant.,Demographic and Health Surveys.SP.POP.0014.TO.ZS,"Population, ages 0-14 (% of total)",Population between the ages 0 to 14 as a percentage of the total population. Population is based on the de facto definition of population.,The United Nations Population Division's World Population Prospects.SP.POP.1564.TO.ZS,"Population, ages 15-64 (% of total)",Population ages 15 to 64 is the percentage of the total population that is in the age group 15 to 64. Population is based on the de facto definition of population.,"World Bank staff estimates from various sources including census reports, the United Nations Population Division's World Population Prospects, national statistical offices, household surveys conducted by national agencies, and Macro International."SP.POP.65UP.TO.ZS,Population ages 65 and above (% of total),"Population ages 65 and above as a percentage of the total population. Population is based on the de facto definition of population, which counts all residents regardless of legal status or citizenship--except for refugees not permanently settled in the country of asylum, who are generally considered part of the population of the country of origin.",The United Nations Population Division's World Population Prospects.SP.POP.DPND,Age dependency ratio (% of working-age population),Age dependency ratio is the ratio of dependents--people younger than 15 or older than 64--to the working-age population--those ages 15-64. Data are shown as the proportion of dependents per 100 working-age population.,"World Bank staff estimates from various sources including census reports, the United Nations Population Division's World Population Prospects, national statistical offices, household surveys conducted by national agencies, and ICF International."SP.POP.DPND.OL,"Age dependency ratio, old (% of working-age population)","Age dependency ratio, old, is the ratio of older dependents--people older than 64--to the working-age population--those ages 15-64. Data are shown as the proportion of dependents per 100 working-age population.","World Bank staff estimates from various sources including census reports, the United Nations Population Division's World Population Prospects, national statistical offices, household surveys conducted by national agencies, and ICF International."