INDICATOR_CODE,INDICATOR_NAME,SOURCE_NOTE,SOURCE_ORGANIZATIONSP.POP.DPND.YG,"Age dependency ratio, young (% of working-age population)","Age dependency ratio, young, is the ratio of younger dependents--people younger than 15--to the working-age population--those ages 15-64. Data are shown as the proportion of dependents per 100 working-age population.","World Bank staff estimates from various sources including census reports, the United Nations Population Division's World Population Prospects, national statistical offices, household surveys conducted by national agencies, and ICF International."SP.POP.GROW,Population growth (annual %),"Annual population growth rate for year t is the exponential rate of growth of midyear population from year t-1 to t, expressed as a percentage . Population is based on the de facto definition of population, which counts all residents regardless of legal status or citizenship--except for refugees not permanently settled in the country of asylum, who are generally considered part of the population of the country of origin.","Derived from total population. Population source: (1) United Nations Population Division. World Population Prospects, (2) United Nations Statistical Division. Population and Vital Statistics Report (various years), (3) Census reports and other statistical"SP.POP.TOTL,"Population, total","Total population is based on the de facto definition of population, which counts all residents regardless of legal status or citizenship--except for refugees not permanently settled in the country of asylum, who are generally considered part of the population of their country of origin. The values shown are midyear estimates.","(1) United Nations Population Division. World Population Prospects, (2) United Nations Statistical Division. Population and Vital Statistics Report  (various years), (3) Census reports and other statistical publications from national statistical offices, (4) Eurostat: Demographic Statistics, (5) Secretariat of the Pacific Community: Statistics and Demography Programme, and (6) U.S. Census Bureau: International Database."SP.POP.TOTL.FE.ZS,"Population, female (% of total)","Female population is the percentage of the population that is female. Population is based on the de facto definition of population, which counts all residents regardless of legal status or citizenship--except for refugees not permanently settled in the country of asylum, who are generally considered part of the population of the country of origin.",The United Nations Population Division's World Population Prospects.SP.REG.BRTH.RU.ZS,"Completeness of birth registration, rural (%)",Completeness of birth registration is the percentage of children under age 5 whose births were registered at the time of the survey. The numerator of completeness of birth registration includes children whose birth certificate was seen by the interviewer or whose mother or caretaker says the birth has been registered.,UNICEF's State of the World's Children based mostly on household surveys and ministry of health data.SP.REG.BRTH.UR.ZS,"Completeness of birth registration, urban (%)",Completeness of birth registration is the percentage of children under age 5 whose births were registered at the time of the survey. The numerator of completeness of birth registration includes children whose birth certificate was seen by the interviewer or whose mother or caretaker says the birth has been registered.,UNICEF's State of the World's Children based mostly on household surveys and ministry of health data.SP.REG.BRTH.ZS,Completeness of birth registration (%),Completeness of birth registration is the percentage of children under age 5 whose births were registered at the time of the survey. The numerator of completeness of birth registration includes children whose birth certificate was seen by the interviewer or whose mother or caretaker says the birth has been registered.,UNICEF's State of the World's Children based mostly on household surveys and ministry of health data.SP.REG.DTHS.ZS,"Completeness of death registration with cause-of-death information (%)","Completeness of death registration is the estimated percentage of deaths that are registered with their cause of death information in the vital registration system of a country.","World Health Organization, Global Health Observatory Data Repository/World Health Statistics (http://apps.who.int/gho/data/node.main.1?lang=en)."SP.UWT.TFRT,Unmet need for contraception (% of married women ages 15-49),"Unmet need for contraception is the percentage of fertile, married women of reproductive age who do not want to become pregnant and are not using contraception.","Household surveys, including Demographic and Health Surveys and Multiple Indicator Cluster Surveys. Largely compiled by United Nations Population Division."